{
  "schema": "python-slm-p0a-phase-evidence-v1",
  "phase_id": "P0A",
  "interface_id": "portable-interface-v2",
  "profile_id": "prototype-windows-5090-v1",
  "run_id": "20260813T105441939Z-0485a9c7dbe9ab2e31179f75",
  "status": "AWAITING_REVIEW",
  "generated_at_utc": "2026-08-13T10:54:41.939328600Z",
  "source": {
    "commit": "59c54a0fc350c389682f39499db62c46d7bb03a6",
    "tree": "596dfc8d7fc299d6a9cc760c1fdccb6ddfefcc75",
    "branch": "main",
    "dirty": false,
    "cargo_lock_sha256": "719bd8ae1fad884f18848e870773df0323fc5ff0433f26449f2f47301ba6361f",
    "identity_ref": {
      "path": "artifacts/source-identity.json",
      "sha256": "9196704a44441136d923e6a9b4b57b22327f5132aee75c5206ad5ad86b42b7cc",
      "bytes": 481
    }
  },
  "p0_dependency": {
    "status": "PASS",
    "baseline_commit": "b1ebb455cdae94bbb9fc54f246cdf2758eedf1d1",
    "receipt_commit": "86fb1e4cc68efeb651e5362c4aca85c2827d8e4d",
    "receipt_sha256": "f08c6a41658ff287e238d6a96c4f2c874975964202c3eeced2bc0bc21f308904",
    "contract_sha256": "fc2c60b52fdd7c524e0da06bb03972a4d523c21ad5536cba536185435bd44ad4",
    "decision_ledger_sha256": "8349d8a3e06d96d6921889de5534715e7b2f7439caf7e06558a97652a8890c8d",
    "reconciliation_commit": "245f5f71eb3a76b3ce8e7c42228c00167803947c",
    "reconciliation_tree": "c7a322bc77aebab6a5117708f2b74d34365c7336",
    "run_id": "20260811T074740Z-d5008e94",
    "seal_sha256": "184dc926bb9e5e2963a61182398580f7dedbf5aa5992f062dacfc6db6f1430f5",
    "historical_cargo_lock_sha256": "c0a5e1afe02e252a22cca8bf07ab37fb2a25844210d2d5ce2e1e6082e497a28c",
    "oracle_commit": "804cdcec24996895c469f54593a5aa79a4cd706a",
    "oracle_normalized_sha256": "ffaa3b309e31782c95bfed1d4c37eb4b56427bc878c3d796f99d8663de53fe46",
    "reference": {
      "path": "artifacts/p0-dependency.json",
      "sha256": "32dcc531c23e71477d202e147fa40ae5c4231d9056fa715a21f0577b029150eb",
      "bytes": 1072
    }
  },
  "artifacts": [
    {
      "path": "artifacts/0000-prototype-first-portable-interface.md",
      "sha256": "49aab63989beac579c9c62920008c70ed6ba078cb8f6e83bd969e9cb80dd50ba",
      "bytes": 9741
    },
    {
      "path": "artifacts/AGENTS.md",
      "sha256": "fa8cb2fdafd4f2da067d6e92fa5be190e932da1d78925b973c567fa0717d7a4e",
      "bytes": 7266
    },
    {
      "path": "artifacts/ARCHITECTURE.md",
      "sha256": "dea261a11e62a34893026c286c5498ca44b3f5b3add6a7c68436a08818ac8edb",
      "bytes": 20563
    },
    {
      "path": "artifacts/Cargo.lock",
      "sha256": "719bd8ae1fad884f18848e870773df0323fc5ff0433f26449f2f47301ba6361f",
      "bytes": 165439
    },
    {
      "path": "artifacts/TODO-preapproval.md",
      "sha256": "edf293b4001915955d8865ffa9b8b45153a460be252b9ecde17945225985075d",
      "bytes": 97559
    },
    {
      "path": "artifacts/decision-ledger-v2.md",
      "sha256": "25582773a00e34610ae8a215d3705b0bdedbe1020a371996434cf15ce7c04707",
      "bytes": 15129
    },
    {
      "path": "artifacts/p0-dependency.json",
      "sha256": "32dcc531c23e71477d202e147fa40ae5c4231d9056fa715a21f0577b029150eb",
      "bytes": 1072
    },
    {
      "path": "artifacts/parser-boundary.json",
      "sha256": "747ad63cabf5bc4fa2263681d87e90989e9b881bfcd234ea54a22f64e2ed6a50",
      "bytes": 2712
    },
    {
      "path": "artifacts/rebuild-contract-v2.md",
      "sha256": "b4508a6e24358ec387c18c6f536fea665eb33b1c881203bedb5f08b7fd2a2651",
      "bytes": 16538
    },
    {
      "path": "artifacts/schema-bundle.json",
      "sha256": "2acc6d24af9dc329c49587f19c282dc05627fc2f5212b21a87c440dd74e5f233",
      "bytes": 2269
    },
    {
      "path": "artifacts/source-identity.json",
      "sha256": "9196704a44441136d923e6a9b4b57b22327f5132aee75c5206ad5ad86b42b7cc",
      "bytes": 481
    }
  ],
  "commands": [
    {
      "id": "C01",
      "argv": [
        "git",
        "rev-parse",
        "--show-toplevel"
      ],
      "cwd": "${REPO}",
      "exit_code": 0,
      "status": "PASS",
      "stdout": {
        "path": "commands/C01.stdout.txt",
        "sha256": "86a2c37f21b0953888b225db743c58ff99f658eeb4f9340e3c04a87e982927b0",
        "bytes": 8
      },
      "stderr": {
        "path": "commands/C01.stderr.txt",
        "sha256": "e3b0c44298fc1c149afbf4c8996fb92427ae41e4649b934ca495991b7852b855",
        "bytes": 0
      }
    },
    {
      "id": "C02",
      "argv": [
        "git",
        "cat-file",
        "-e",
        "b1ebb455cdae94bbb9fc54f246cdf2758eedf1d1^{commit}"
      ],
      "cwd": "${REPO}",
      "exit_code": 0,
      "status": "PASS",
      "stdout": {
        "path": "commands/C02.stdout.txt",
        "sha256": "e3b0c44298fc1c149afbf4c8996fb92427ae41e4649b934ca495991b7852b855",
        "bytes": 0
      },
      "stderr": {
        "path": "commands/C02.stderr.txt",
        "sha256": "e3b0c44298fc1c149afbf4c8996fb92427ae41e4649b934ca495991b7852b855",
        "bytes": 0
      }
    },
    {
      "id": "C03",
      "argv": [
        "git",
        "cat-file",
        "-e",
        "86fb1e4cc68efeb651e5362c4aca85c2827d8e4d^{commit}"
      ],
      "cwd": "${REPO}",
      "exit_code": 0,
      "status": "PASS",
      "stdout": {
        "path": "commands/C03.stdout.txt",
        "sha256": "e3b0c44298fc1c149afbf4c8996fb92427ae41e4649b934ca495991b7852b855",
        "bytes": 0
      },
      "stderr": {
        "path": "commands/C03.stderr.txt",
        "sha256": "e3b0c44298fc1c149afbf4c8996fb92427ae41e4649b934ca495991b7852b855",
        "bytes": 0
      }
    },
    {
      "id": "C04",
      "argv": [
        "git",
        "cat-file",
        "-e",
        "245f5f71eb3a76b3ce8e7c42228c00167803947c^{commit}"
      ],
      "cwd": "${REPO}",
      "exit_code": 0,
      "status": "PASS",
      "stdout": {
        "path": "commands/C04.stdout.txt",
        "sha256": "e3b0c44298fc1c149afbf4c8996fb92427ae41e4649b934ca495991b7852b855",
        "bytes": 0
      },
      "stderr": {
        "path": "commands/C04.stderr.txt",
        "sha256": "e3b0c44298fc1c149afbf4c8996fb92427ae41e4649b934ca495991b7852b855",
        "bytes": 0
      }
    },
    {
      "id": "C05",
      "argv": [
        "git",
        "cat-file",
        "-e",
        "804cdcec24996895c469f54593a5aa79a4cd706a^{commit}"
      ],
      "cwd": "${REPO}",
      "exit_code": 0,
      "status": "PASS",
      "stdout": {
        "path": "commands/C05.stdout.txt",
        "sha256": "e3b0c44298fc1c149afbf4c8996fb92427ae41e4649b934ca495991b7852b855",
        "bytes": 0
      },
      "stderr": {
        "path": "commands/C05.stderr.txt",
        "sha256": "e3b0c44298fc1c149afbf4c8996fb92427ae41e4649b934ca495991b7852b855",
        "bytes": 0
      }
    },
    {
      "id": "C06",
      "argv": [
        "git",
        "rev-list",
        "--parents",
        "-n",
        "1",
        "86fb1e4cc68efeb651e5362c4aca85c2827d8e4d"
      ],
      "cwd": "${REPO}",
      "exit_code": 0,
      "status": "PASS",
      "stdout": {
        "path": "commands/C06.stdout.txt",
        "sha256": "7a6b2885ba1fd46f4d2f1326c2c74e541d6e19bc54daabcd1f59d588f2a57281",
        "bytes": 82
      },
      "stderr": {
        "path": "commands/C06.stderr.txt",
        "sha256": "e3b0c44298fc1c149afbf4c8996fb92427ae41e4649b934ca495991b7852b855",
        "bytes": 0
      }
    },
    {
      "id": "C07",
      "argv": [
        "git",
        "rev-list",
        "--parents",
        "-n",
        "1",
        "245f5f71eb3a76b3ce8e7c42228c00167803947c"
      ],
      "cwd": "${REPO}",
      "exit_code": 0,
      "status": "PASS",
      "stdout": {
        "path": "commands/C07.stdout.txt",
        "sha256": "ebc7807dabb7d70d54fcd6913bc842bef643bd2516447b6c27434284f5d7a540",
        "bytes": 82
      },
      "stderr": {
        "path": "commands/C07.stderr.txt",
        "sha256": "e3b0c44298fc1c149afbf4c8996fb92427ae41e4649b934ca495991b7852b855",
        "bytes": 0
      }
    },
    {
      "id": "C08",
      "argv": [
        "git",
        "rev-parse",
        "245f5f71eb3a76b3ce8e7c42228c00167803947c^{tree}"
      ],
      "cwd": "${REPO}",
      "exit_code": 0,
      "status": "PASS",
      "stdout": {
        "path": "commands/C08.stdout.txt",
        "sha256": "18fb981527c9dfbb459decaadf1fbe7e4f13cc0a622bc2f7e8a88aafdaacdcb7",
        "bytes": 41
      },
      "stderr": {
        "path": "commands/C08.stderr.txt",
        "sha256": "e3b0c44298fc1c149afbf4c8996fb92427ae41e4649b934ca495991b7852b855",
        "bytes": 0
      }
    },
    {
      "id": "C09",
      "argv": [
        "git",
        "merge-base",
        "--is-ancestor",
        "86fb1e4cc68efeb651e5362c4aca85c2827d8e4d",
        "HEAD"
      ],
      "cwd": "${REPO}",
      "exit_code": 0,
      "status": "PASS",
      "stdout": {
        "path": "commands/C09.stdout.txt",
        "sha256": "e3b0c44298fc1c149afbf4c8996fb92427ae41e4649b934ca495991b7852b855",
        "bytes": 0
      },
      "stderr": {
        "path": "commands/C09.stderr.txt",
        "sha256": "e3b0c44298fc1c149afbf4c8996fb92427ae41e4649b934ca495991b7852b855",
        "bytes": 0
      }
    },
    {
      "id": "C10",
      "argv": [
        "git",
        "merge-base",
        "--is-ancestor",
        "804cdcec24996895c469f54593a5aa79a4cd706a",
        "HEAD"
      ],
      "cwd": "${REPO}",
      "exit_code": 0,
      "status": "PASS",
      "stdout": {
        "path": "commands/C10.stdout.txt",
        "sha256": "e3b0c44298fc1c149afbf4c8996fb92427ae41e4649b934ca495991b7852b855",
        "bytes": 0
      },
      "stderr": {
        "path": "commands/C10.stderr.txt",
        "sha256": "e3b0c44298fc1c149afbf4c8996fb92427ae41e4649b934ca495991b7852b855",
        "bytes": 0
      }
    },
    {
      "id": "C11",
      "argv": [
        "git",
        "diff",
        "--exit-code",
        "b1ebb455cdae94bbb9fc54f246cdf2758eedf1d1",
        "--",
        "docs/rebuild-contract.md",
        "docs/receipts/P0/capture.ps1",
        "docs/receipts/P0/evidence.json",
        "docs/receipts/P0/runs"
      ],